Yorum,Duygu
aldim bi kere kullandim simdi duruyor bi kosede cok berbat bi urun verdigim para bosuna gitti,0
cok kotu bir urun hic kullanmadan 1 kere yikadim butun renkleri soldu kullanamadan verdigim paraya yazik gercekten,0
2 yikamada  dusuk isida yikamama ragmen urunun rengi soldu igrenc bi hal aldi asla tavsiye etmiyorum,0
Urun cok kotu yuz kere yikanmis gibi renkler ilk yikamada soldu tavsiye etmiyorum,0
anneme aldim cok begendi tam oldu,1
Urun berbat ilk yikamada mahvoldu aldigima pismanim,0
Resimdeki gibi hic canli degil  sert bi kumasa sahip begenmedik,0
Bir yildiz bile cok bu urun icin internetten aldigim en berbat urun bu urunu alacaklara da sesleniyorum sakin almayin TRENDYOL da boyle firmalara satis yaptirmasa iyi olur..!,0
URUN KULLANMADAN EVVEL KI ILK YIKAMADA SOLDU. FOTOGRAFTA GORUNDUGU GIBI DEGIL YASTIK KILIF DESENLERI FARKLI. MEMNUN KALMADIM TAVSIYE ETMIYORUM.,0
Sert ve kalitesiz sofra bezi gibi  ,0
