Yorum,Duygu
"""Urun sorunsuz elime ulasti. Is yerim icin aldim, cok memnunum.""",1
"""Cidden harika bir urun, ogrenci evim icin aldim, cok guzel. Harika bir urun, guzel sogutuyor.""",1
"Urun guzel, kargoda sorunsuz.",1
"Sorunsuz sekilde teslim aldik, fiyat performans cok guzel, tesekkurler ",1
"""Hersey cok guzel ve hizli bir sekilde geldi, tesekkurler. Iyi aksamlar.""",1
"""Guzel kullanisli no frost olmasi sebebiyle tercih ettim en fazla 4 kisilik aileler icin ideal umarim uzun sureli kullanimi olur.""",2
"""Urun nokta hasarsiz geldi kuruldu cok memnunum tavsiye ederim Trendyol da tesekkur ederim.""",1
"""Memnun kaldik.""",1
"""Indirimdeyken almistim. Kargo ile de sorun yasamadim. MasaAllah Gercekten cok guzel sogutuyor. 3 kisilik aileyiz, bizim icin bile oldukca buyuk. 4 kat rafi var. Ben cok memnunum.""",1
"""Buzdolabini anneme aldim. Horoz lojistik ve media markt cok iyi is cikardi. Siparisim ertesi gunu yola cikti ve iki gun sonra geldi. Ertesi gunu de servis gelip kurulumu yapti. Buzdolabi cok guzel, cok kullanisli, gayet genis ve ferah.""",1
Cok guzel bir urun genis baya anneme de aldik,1
Mukemmel bir dolap indirimde aldim cokta memnun kaldim tavsiye ederim,1
sorunsuz ve kisa surede elime ulasti servis ertesi gun gelip kurdu dolap da hacmi cok genis kullanisli samsung kalitesi...,1
Anneme hediye aldim. Cok begendi. Guzel kullanisli🤌,1
Daha kurulum yapilmadi insallah guzeldir. Yorumlara bakarak aldim,1
indirimden almistim 2. evime almadigima pisman oldum,0
urunu cok begendim cok tesekkur ederim,1
Guzel saglam geldi ve sorunsuz. Tesekkur ederim satici ve Trendyola,1
argos elektronige cok tesekkur ederim okadar ilgili bir saticiki kargo sorunuyla bile yakinen ilgilendi.Dolabin kurulum bugun oldu kullanmadan yazmak istemedim bu fiyata alinabilecek en iyi dolap alacaklara tavsiye ederm hem ideal genislikte hemde Samsung kalitesi tabiki tencereler rahat sigiyor ust kahvaltilik bolumu olsn enalt sebzelign genisligi,1
Harika tesekkurler trentyol,1
sorunsuz geldi gayet guzel memnun oldum,1
sorunsuz geldi tsk ederim,1
cok guzel kaliteli bi urun sebzeleri haftalarca taze tutuyor siddetle tavsiye ederim,1
Muko kesin alin,1
gayet sorunsuz geldi tesekkurler,1
Cok guzel cok memnun kaldim tesekkur ederim ,1
"Mukemmel, Tesekkurler Trendyol.",1
cok memnunum tavsiye ederim cok guzel cok kullanisli vede cok guzel geldi teslimat cok guzel elinize saglik cok tesekkur ederim ,1
Cok begendim sorunsuz teslim aldim sogumasi mukemmel kalabalik aileler icin biraz ufak4 kisilik aile icin ideal sadece ayak tekerlekleri gorunmese daha iyi olurdu,1
Harika tesekkur ederim,1
cok hizli teslim edildi kaliteli urun,1
gayrt iyi dolap,1
sorunsuz bir urun aldim emegi gecenlere cok tesekkur ediyorum,1
Evde kullandim memnun oldugum icin is yerimede aldim,1
Sorunsuz teslim edildi. Ic hacmi genis yedek olarak almistim kurtarici oldu. Buzluk kisminin sogutucu olarak kullanilmasi super,1
Piyasaya gore daha uygun fiyata aldik guzel bi urun ust bolmesini dondurucu olarak kullanmak istemezseniz ayari var ona gore ayarlayip normal buzdolabi seklinde de kullanabilirsiniz ici genis bi evin ihtiyacini karsilayabilir bence almak isteyenler dusunmeden alsin,2
"Samsung Coling tower sogutma ozelligiyle fakli bir buzdolabi  urun , kalitesi kendini gosteriyor. Tesekkurler Trendyol. ",1
Tereddut ederek aldim 1 aydir kullaniyorum tavsiye ederim,1
"ic genislik olsun sessizligi olsun 10 numara ozellikler ve goruntusu cok iyi , camasir ve bulasik makinalari gurultulu en azindan buzdolabi iyi cikti",1
"Hem urunden, hem de firmadan aldigim hizmetten son derece memnunum. Hizli teslimat, teslimat sonrasi hizli ve sorunsuz cozum ve hizmet. Daha ne olsun? Cok tesekkur ederim.",1
guzel kullanisli,1
ic hacmi baya genis ve kulanisli samsung kalitesini bilen bilir anltmaya gerek yok,1
Tek kelime ile harika..,1
urunu cok begendim,1
iyi guzel,1
Urunu tavsiye ediyorum,1
urunu cok hizli ve hasarsiz teslim aldik ici genis cok kullanisli tesekkurler,1
Dunyanin en kotu urunu,0
Cok memnunum. Farkli urunler icin farkli sogutma seviyelerine sahip alanlarin olmasi cok guzel. Servis de hizli geldi ve cok ilgiliydi,1
"Alali neredeyse 1 sene olacak cok memnun kaldik, tavsiye ederim.",1
mukemmel bir urun,1
samsung bir urune hep gozum kapali guvenirimmm,1
urun gayet guzel ve kullanisli kargo hizmetleri son derece guzel tesekkurler,1
Gayet guzel,1
kayinvalideme aldik ve gayet memnunlar sorunsuz ulasti,1
boyutu iyi begendim memnun kaldim,1
Isyerine aldik cok memnunum,1
Fan biraz ses cikariyor ama rahatsiz edici bir seviye de degil ... Bir buzdolabindan istediginiz herseyi veriyor,1
Efsane tavsiye ederim,1
Ici genis kullanisli urunu cok begendik tesekkur ediyoruz tavsiye ederim,1
"Samsung kalitesi 1 ay oldu kullaniyorum asirisi sessiz calistigini anlamiyorum bile, sogutmasi ise harika yicekler guvende",1
mediamarkt son derece iyiydi tesekkurler ama arvato diye bir kargoyla gonderiyorlar hayatimda gordugum en kotu kargo sirketi.iade icin gunlerce  beklettiler ne subesi var ne numarasi ulassaniz bile bilgi veremeyiz diyorlar,0
"Orta segmentte alinabilecek en guzel buzdolabi, fiyati ucuz ama parcalari pahaliymis ilave sigorta yaptirdim. Kargo cok hizli geldi, sorunsuz kurulum, sesi az, terlemeyi yanlardan veriyormus o yuzden yanlari sicak olabilir dediler ama 3 gundur kullaniyorum son derece normal bi sicaklik var yan taraflarinda. Icine 2 buyuk tencere yarim karpuz gibi",1
Simdilik cok iyi,1
Cok guzeldi ,1
Istanbul / Kucukcekmece de oturuyorum 5 haziranda siparis verdim 7 haziranda oglen geldi. Tasima iyiydi distan herhangi bi kusuru yoktu. Ceyiz icin aldim. Umarim kurulum zamaninda cihazdada bi sorun cikmaz. Tesekkur ederim ilginiz icin. ,1
Tavsiye ederim arastirip almistim,1
Raflar biraz ince ama samsung kalitesi hissediliyor,1
Gayet guzel kullanisli buzzz gibi yapiyor konforlu cok memnunuz ☺️,1
cok guzel tavsiye ediyorum,1
memnunum  tavsiye ederim,1
Cocugum icin  aldim. Amator kullanicilar icin beklentinin otesinde.  Tam bir fiyat  performans urunu.,1
"yegenim e aldim cok begendi, surpriz yaptim , cok hizli gitti firmaya ve kargoya cok tesekkur ederim yanliz istedigi degilmis ,iade edip istegini alacagiZ sizi gordugum icin kusura bakmayin :",
arkadasimin 7 yasindaki cocuguna hediye aldim. cocuk icin yeterli hafiza karti eklemek gerekiyor,2
Fiyatina gore is gorur. Daha profesyonel seyler dusunuyorsaniz yuksek fiyatli urunleri almaniz gerekiyor ben oglumu aldim oglum bile kendi capinda video cekmesine ragmen gozu bir tek yukarlarda,2
Kuzenim icin aldik cok begendik yasi kucuk olanlar icin ideal,1
"Su altinda goruntu zayif, ne cektiginizi gormeden cekiyorsunuz.  Bazen karti okumuyor  gibi ama acip kapatinca duzeliyor.  Ama f/p olarak iyi. Yazin su altinda eglenceli fotograflar ve videolar cektik. Guzel bir hatira kaldi. Cocuklarin gonlu oldu. Bence bu yeterli.",0
Tam bir fiyat performans urunu. Su alti denedim. Yeni baslayanlar icin oneririm.,1
sorunsuz geldi memnun kaldik,1
eski teknoloji gibi ama idare eder duruyor. cok uygun fiyata aldim acildigina sukur :)) ben eglencesine aldim denemek icin guzel duruyor,1
gercekten mukemmel goruntuler elde ediyorum. eski bir selfie cubuguna takip denizde samandiralarin ipine sabitleyip video cekiyorum sonra bilgisayarda videolari kirp diyince mp4 formatina otomatik geciyor bu sekilde telefonuma aktarabiliyorum avi formatini telefonlar desteklemiyo. ve begendigim anlarin ekran goruntusunu aliyorum. profesyonel,1
cok guz3l urun,1
vasat urun,0
"Havuzda kullandik, sorunsuz. Kullanimi kolay fakat goruntuleri bilgisayara yukleyemedik. Fotograflar yuklendi ,videolar gozukmuyor.",2
is gorur ufak cocuklar icin iyi,1
"Hafiza problemi var, desteklemeyeceginden oturu cok yuksek gb kullanamiyorum. Sarji cabuk bitiyor goruntu kalitesi fena degil. Fiyat performans olarak bakildiginda muadillerin arasinda iyi duruyor.",2
hafiza kartsiz geliyor cok dandik birsey goruntu kalitesi sifirin altin 1980 model araba gibi dusunun berbat otesi,0
Cok guzel yazin kullanicaz,1
Goruntu kalitesi biraz dusuk ama yinede kullanilabilir,2
F/p urunu cok yuksek goruntu kalitesi beklemeyin 480p gibi puslu ama idare eder profesyonel kullanim degil de amator kullanim icin uygun,2
daha deneme firsatim olmadi ama kargo cok hizli geldi butun aparatlari saglam ve eksiksiz guzel duruyor goruntu kalitesi cok guzel degil ama fiyatina gore guzel bir urun,2
"Hafif, goruntu kalitesi guzel denilebilir bu kamera icin. Sarji cabuk bitiyo ama.",2
"Tam bir fiyat performans urunu. Gunluk trafik akisinizi kaydedecekseniz ideal bir kamera.  Olumlu taraflari : Fiyatina gore goruntu kalitesi iyi, urun tum aparatlarla beraber geliyor. Sarzi 2",
Kullandik guzel,1
cok bi kalite beklemeyin. kizim vakit gecirsin diye almistim. ara ara kendiliginden kapaniyo. fakat beklentimi karsiladi.,0
gayet iyi begendik,1
Kalitesiz almayin,0
Kotu yorumlara bakmayin 720p cekimde efsane su altinda da cok iyi cekiyo mikrofonuda baya iyi,1
"Goruntu kalitesi kotu, 12 mpx ile alakasi yok.",0
cok kotu bence almayin paraniza yazik,0
Fiyat performans acisindan iyi bir urun,1
her sey cok iyiydi. bol bol kullandik. gayet basarili bi urun,1
Goruntu kalitesi zayif ve hafiza karti icinde yok ama hos bir kamera.,1
Kizim cok istedi aldik cok memnun tatilde havuzda cekim yapmayi dusunuyor bakalim nasil olacak,2
cok guzel cihaz,1
Bence gayet guzel,1
cok bisey beklememek lazim fiyatina gore,2
Fiyat performans urunu denemek icin uygun bir fiyata aldik memnun kaldik,1
Kullanisli ,1
Arac ici kamera olarak kullaniyorum gayet guzel,1
malesef ,0
Malzeme kalitesi cok iyi degil,0
Cok guzel,1
Urun guzel ve kullanisli,1
Bekledigim gibi geldi. Goruntu kalitesi cok yuksek degil ama orta cekimde iyi.,2
guzel urun hizli kargo,1
harika bu fiyata bu urun,1
su alti deniz kamerasi efsane cok guzel cok net gosteriyor,1
oyuncak olarak alinabilir.,0
beyaz ekran ,0
Keske icine kamerayida koysaydiniz.,0
fiyat performans urunu hizli satici memnun kaldik,1
urun video cekimi yapmiyor,0
Fiyat performans urunu. Kullanisli. Cok iyi cekim yapmiyor ancak zaten bu fiyata buyuk bir beklentiyle almadim. Oglum tatilde kullansin diye aldim. Hafiza kartini ayrica almaniz gerekiyor. O da icinden ciksa daha iyi olurmus.,2
goruntu kalitesi kotu. kayit yapiyor ama cok bulanik.,0
su alti kamerasi olarak guzel cekim,1
Urun fiyatina gore guzel .Satici cok ilgili .Tesekkurler..,1
urunu aldim fakat kullanmaya daha zamanim olmadi.sualti cekimi iyiyse benim icin tamamdir.,2
fiyat performans acisindan iyi idare eder bir kamera,2
fiyat6na gore iyi is gorur,1
Fiyata gore iyi ama gerek yok,2
"Kesmiyor etleri yoluyor, kalitesi dusuk ve farkli marka yollanmis.",0
hala gelmediiiiii,0
Ablama hediye olarak aldim. cok begendi sarisi cok acik rengi degil ama tam goruldugu gibi de degil orta indirimdeyken alinmasini oneririm,2
Urunu hediye olarak almistim indirimden aldim cokda kaliteli degil indirimden aldigim icin iade etmedim,2
Kayinvalidem hediye aldim kumasina ve modelini begenmis,1
urunu begebdim indirimden almistim,1
merhabalar gozel set aldim beyendim ve 4tane aldim guzel ve rahat kulanislidir yikamada sorun olmadi tsk imdirim olursa haber verin sayqlarla,1
Sakin ama sakin almayin buyuk bir istekle surpriz olarak almak istedim fakat gelen urun sonrasi mahcup oldum parama yazik bildiginiz naylon ve rengi cok soluk haketmiyor parayi kesinlikle,0
Cok guzel deseni var. Hediye aldik bayildilar. Biraz pahali ama. Osmanli desenleri severler bayilir.,1
Gold ve avangart asigi biri olarak cok begenerek aldigim ve cok severek kullandigim bir urun. Tesekkurler trendyol,1
Anneme indirimden almistik cok kaliteli bir urun degil ince ve tek yikamada rengi soldu,0
indirimde almistim ama yine de fiyatina gore kalitesi cok dusuk iade ettim,0
daha once alip kullanmak icin sakladigimiz bir urundu 30 C de yikanmasina ragmen renk atti camasir suyu degmis gibi oldu kesinlikle kaliteli bir kumasida yok asla tavsiye etmiyorum asla bu sayfadan birdaha alis veris yapmayacagim,0
Asla gorsele aldirmayin gorundugu gibi gelmedi anneme hediye almistim ben uyurken kargo gelmis annem alip makineye atmis yikamak icin yoksa aninda iade ederdim yan dikislerini sokup tekrar dikmisler erbat duruyor rengi soluk kumasi kalitesiz sakin almayin,0
urun bugun elime gecti 30  derecede yikadim cok buyuk husrana  ugradim mahcubiyetimi ise anlatamam anneme hediye almistim  rengi tamamen soldu gorundugu gibi asla degil cok yazik ....,0
urun cok guzel cok kaliteli ceyiz hediyesi almistim indirimden memnun kaldim,1
bu urunu hediye almistim ben cok begendi hediye ettigim kisi cok guzel dedi,1
Ceyizime aldim efsooo,1
Bu fiyata daha duzgun bir sey alinabilir. Tek guzel olan tarafi desen. Kumasi pek kaliteli degil. Indirimde aldigima ragmen degmedi,0
hediye aldim cok begendiler.,1
Hediye aldik ve cok kullanisli,1
uc kurus  fazla olsun kaliteli olsun. ablama hediye aldim rengi soluk geldi sonra  yikandi renk menk kalmadi paraniz bosa gitmesin almayin.,0
hediye olarak aldim cok begebdiler,1
kalitesi fazla iyi degil sus amacli kullanilabiliyor,2
urunden iki tane aldim ama birinin carsafini cift kisilik olmasina ragmen tek kisilik koymussunuz  ve butun guzelligi batirdiniz cok sagolun gercekten ,0
Fiyati urune gore uygun rengi de canli aynisi gibi geldi tesekkurler Trendyol,1
ASLA ALMAYIN ASLA !!! PARANIZA YAZIK 1 KERE YIKAYINCA RENGI SOLUYOR CIFT KISILIK YERINE TEK KISILIK CARSAF YOLLAMISLAR,0
urun COK kotu bir kac yikamada hemen soldu 10 yillik nevresim gibi duruyor kesinlikle almayin,0
Gercekten durusu cok sik.Yeni modadan cok utu istemez sanirim.,1
tesekkurler trendyol,1
Bir yakinimiza evlilik hediyesi olarak aldik. Cok guzel. Kalitesi rengi dokusu mukemmel. Kendimize de almayi dusunuyorum.,1
Pes orani pamuktan daha yuksek pek yumusak bir dokusu yok. gorseli guzel ama kullanisli degil. Ben yatak ortusu olarak kullanicam evde fazladan yatagim var modelini begendigim icin iade etmeyecem,2
Mukemmel olmus elinize saglik  ,1
urun cok kaliteli degil ama kargo iyi cabuk geldi fiyat  ta indirim olunca bende kaliteli bisey  sanmistim ne yazikki naylon,0
bugun geldi cok begendim rengi dokusu canli fiyata gore cok.uygundu indirimleri takip edin alin,1
Cok cok kotu bir urun incecik kumasi var . ayaga kardirinca ici gozukuyor . Daha ilk yikamada siyah renk atti ve grilesti . Desenini ve renklerini begendigim icin 2 tane almistim ama cok kotu ve kalitesiz bir urun simdi keske 2. yi almasaydim diyorum sanki parami cope attim . Asiri kotu akliniz varsa goruntuye aldanmayin gidin magazadan dokunarak,0
kayinvalideme anneler gununde hediye almistim rezil oldum o kadar kotu yani ,0
Berbat bir urun zaten resimde gorundugu model gelmedi. Modeline bakmak icin mecbur paketini acmak zorundasiniz paketi acinca da iade kabul etmiyorlar resmen cop yani yikayinca rengi soldu siyahti griye dondu,0
Fiyatina gore kalitesi iyi tek kisilik kirmizi rengini kullaniyorum cift kisiligine denk gelirsem onuda alacagim,1
cok guzel bir urun birisi icin siparis etmistim cok begendi,1
Cok begendim ozellikle modelini..,1
Annem ve teyzeme aldim cok begendiler ama kumasi sert guzel degil ve cekme yapti ben begenmedim kaliteli bir sey degil incecik,2
berbat bir urun asla.almayin rengi ayni degil soluk renk li ve cok once kumas terleten ve cok rahatsiz.edici killi gibi tufler var cok sik bin pismanim,0
resmen aldatmaca fotografta gorunen le ilgisi alakasi yok resmen pazar mali belki pazarda bile bu kadar kotusu satilamazdi yazik verilen paraya,0
Indirimli olarak almistim ilk yikamada renk tonlari   acildi bekledigim gibi gelmedi kullandigim deterjan renk koruma ozellikli 30 derecede yikadim Kumasida kaliteli degildi,0
Cok sik duruyor.,1
Nevresim cift kisilik diyorsuz ama ortuk cok kucuk sevmedim,0
Kalitesi cok kotu. Ne rahat uyunuyor ne de canli desenler var . ilk yikamada soldu.  Aldigima pisman oldum.,0
Cokkkk sik,1
Soluyor diye yorum yapmistim ancak yikanma hatasindan oldugunu farkettim. Solma minimum ancak terletme yapiyor. Deseni guzel.,1
Guzel urun,1
Guzel hos duruyo,1
cok begendim tam oldu.,1
Anneme almistim cok begendi,1
carsafi tek kisilik geldi renk yikayinca bozuldu,0
asla ve asla tavsiye etmiyorum trendyoldan alisveris yapmayin,0
Urun cok guzel cok sik duruyor,1
sekli guzel ama kalitesi kotu hic tavsiye etmem,2
Super  cok begendim cok  sik urun ❤️,1
Boyle kalitesiz berbat bi nevresim takimi omru hayatim boyunca gormedim.resimdeki gibi asla degil kandirmak icin fotosop yapmislar .Gelis paketleme berbat acilmis geldi.iade edemedim .agir berbat bir koku vardi yikadim daha kullanmadan rengi tamamiyle soldu allah sahit aldiginiz para helal olmasin aldiginiz paranin 1 kurusunu dagil haketmiyosunuz.,0
cok gosterisli  duruyor  begendik,1
berbat bir urun. kargoyu actigimda soluk bir urundu. yikadiktan sonra rengi tamamen gitti. asla tavsiye etmiyorum,0
Bekledigimden cok daha hos cikti urun.,1
Berbad bir urun. Cox pesmanam aldigim ucun.,0
Cok sik ve gorundugu gibi,1
utun gercekten guzel ve sik,1
Ilk yikamada sorun yasadim renkler soldu urun gec geldi  ‘’ TAVSIYE ETMIYORUM  ‘’,0
Berbat bir nevresim takimi yikamadan soldu sakin almayin,0
esim  rahatsiz oldu.. yikamadan onceki dokusuda ayniydi yikadiktan sonrada.  ehh  goruntu boyle uzakatan guzel,0
Bir yikamada rengi soldu zaten geldiginde de pek canli degildi tavsiye etmiyorum,0
nazik sevmedim,0
Tek yikamada soldu pismanlik ! Urun cift kisilik carsafi tek kisilik asla alinmaz,0
urun geldi tskler,1
gorunusune aldanmayin o kadar kotu kumasi nasil bu kadar guzel gosterdiler anlamiyorum kumas tamamen naylon paraniza yazik etmeyin,0
paketi acar acmaz degisik agir bir koku sardi etrafi ustelik cok fazla naylosumsu penye gibi degil,0
Paketleme kotu sadece urun basarili,2
cok guzel ciddiyim almaniz lazim ama lacivert olsa daha iyiydi,1
Cok iyi. Kullanisli Bi urun.  Paketleme iyi teslim suresi kisa.,1
urun cok kotu hic begenmedim ilk yikamada renk atti soldu resimdekiyle alakasi yoktur. daha uyguna aldigim  farkli urunler bile daha guzel cikti. bu yorumu  okuyun ve almayin sakin .,0
B,
berbat hem tek kisilik geldi hem kumasi berbat,0
harika bir nevresim takimi,1
Aslinda cok sik cok guzel tam boyle geliyor 2 yikamada renk kalmiyor inanilmaz soldu mahvoldu,0
idreedr. bnn,0
Ben saten zannedip aldim fakat normal geldi yinede cok memnun kaldim goruntusu de kaliteli si de guzel,1
Gorunus kotu,1
Guzel sik urun ve hizli kargo,1
guzel cok seviyorum,1
Urunun kalitesi hic iyi degil almanizi tavsiye etmem ben aldim acmis bulundum,0
guzel tavsiye ederim,1
Berbat bir urun. Ilk yikamada tum renkler yok oldu sanki . 20 yildir kullanilan bir urun gibi oldu bir daha ne yatagima orterim boyle urunu direk cope attim asla tavsiye etmem,0
Ilk defa alisveris yaptim kargo paketleme guzeldi urunu cok begendim tavsiye ederim,1
urunu cok begendik emegi gecen herkezin eline saglik cok tsk ederiz,1
gorundugu gibi degil  kalitesiz yastik kilifi modelleri fotograflarindaki gibi farkli geldi ama iade etmedim gundelik kullanacam,2
urun harika nevresim carsaf yastik kilifi hepsi icinde ....hizli kargo kaliteli urun .....tesekkurler,1
urunu hic begenmedim daha ilk yikamada butun rengi akti verdigim para bosuna gitti siz boyle bi urunu nasil gonderiyounuz aklim almiyo gorselde cok guzel duruyo fakat ilk yikamada butun rengi akiyo sakin almayin arkadaslar,0
"Urunu cooook beyendim iyiki de aldim. Paketlenmesi, hizli teslimat ucun tesekkur ederim",1
Urun anlatildigi gibiydi cift kisilik yataga tam oturdu 160,
Selin cigerci den duyup almistim ama cok pisman oldum renkleri canli degildi ve tek yikamadan sonrada 5 yillik urun gibi oldu sakin almayin,0
Resime aldanmayin gorundugu gibi degil rengi soluk ve kumasi sert,0
urun hic gorundugu gibi degil parlak gozukuyor canli gozukuyor resimde fakat degil ben ceyizime almistim yastik kiliflari da resimdeki gibi degil 1 yikamada soldu ztn boyle canli gorunumu yoktu kumasi da berbat tavsiye etmem pisman oldum ben,0
urune puan vermiyorum  cunku yorumlara ragmen aldim bugun geldi gec geldi bekliyorsunuz bide kotu cikinca insanin hevesi kiriliyor Osmanli denmis hic yakusiyomu ya iaddele ugrasmicam bide parani bekle,0
guzel machaalah ,1
Harikaaa bir kumasi var. Cok begendik esimle. Tesekkurler trendyol ,1
indirimdeyken aldim fotograf a gore mat  carsafida biraz kucuk ayrica yastik gorseldekinden farkli desende,2
guzel rengi,1
Kumasi cok rahatsiz edici,0
hic yildiz vermicektim ama yorum yapabilmek icin verdim hic iyi degil bir kere yarim saatlik attim makinaya soldu akti siyahi tavsiye etmiyorum.,0
kalitesi asiri kotu gercekten naylon gibi ve asiri sert bir yapisi var ve paketinden ilk cikardiginizda o kadar kotu bir kokusu var ki dayanamadik bile kesinlikle onermiyorum,0
guzel tam oldu,1
,1
cok kotu hic tevsiye etmiyorum aldim ancak kalitesi 0  renginde buradaki kibi diyil yemin ederim parlama yazik oldu ben Azerbaycandan siparis etdim  aslinda en begendigim nevresim takimi bu idi ama Cox kotu cikti,0
Berbat Bi urun sakin almayin bir yikamaya renk denen bir sey kalmadi yaziklar olsun saticiya,0
Muhtesem asil,1
Urunun kalitesi de rengi de iyi degil canli siyah degildi bile pisman oldum aldigima.,0
urun foto daki gibi degil. firma ozensiz. yastik kiliflari resim deki gibi degil deseni degisik geldi,0
Gorunusu guzel olmasina ragmen kalite olarak hic guzel degildi naylonsu bir yapisi vardi.,0
Cok begendik erken kargo geliyor guzel urun herkese tavsiye ederim,1
kullanisli hizli kargo tesekkurler,1
mukemmel otesi,1
Urun cok kalitesizdi verilen paraniza yazik almayin kesinlikle. Renkler soluktu zaten Yikama  sonrasi iyice berbat oldu.,0
Hic guzel degil almayinnnnn,0
Bir yikamada renk atti. Gorunusu kadar asil degil. Fotolarla alakasi yok.,0
Hic memnun kalmadim gelen urun elek gibi yeri ve gelince yikadim rengi soldu,0
gorundugu gibi canli bir renk degil icim atarak aldim burukarak kullaniyorum,0
Rengi tek yikamada cikti cok cok cok kotu,0
cok hizli geldi bi de cok guzel,1
cok guzel cok begendim cabuk var hizli sekilde getirdiler tesekkur ediyorum,1
Bugun teslim aldim cok begendim tesekkur ederim,1
Asla almayin yikaninca kumasi soldu gitti hic guzel degil,0
Tek yikamada kisa program olmasina ragmen rengi atti rezil bir urun hakkimi helal etmiyom,0
"Rengi tek yikamada soldu, eski gibi oldu. Tavsiye etmiyorum.",0
Bir yikamada rengi gitti ve diger ortume siyah renk cikti kimsenin almasini tavsiye etmem,0
ilk yikamada rengi ole bir gidiyor ki gorunumu icin soylediginiz nevresimin hicbir degeri kalmiyor.Nevresim de yiknamadan olmaz.Yorumlari okuyup bir sey olmaz deyip soyledik pisman olduk.Ayrica cok sert hos degil.,0
muhtesemdi ya gercekten ama rengi soldu,1
"Urunun renkleri cok cansiz ve resimde gorundugu gibi parlak degil. Ayrica, kumasida biraz serttir, yumusak degildir. Tavsiye etmiyorum.",0
Kaliteli ve hizli gonderim yapildi tesekkur ederim,1
Ilk yakamada rengi soldu bu nasil urundur hic memnun kalmadim yildiz bile verilmez...,0
berbat bir urun iki yikamada soldu tavsiye etmiyorum,0
guzel paketlenmisti,1
"resimde kaliteli saten kumas gibi gorunuyor yolladiklari  incecik naylon gibi. kumasi pamuk65 pes35 yaziyor nasil birsey oldugunu bilmiyordum. pikesinide almistim, bu fiyata beklenti yuksek olmamali aslinda. desani guzel, iscilik iyi, defosu yok, hizli teslimat sadece kumasi kotu, keske bu kumas tan nevresim degilde tul perde dikselermis daha verim",2
Yikaninca soluyor kesinlikle tavsiyes  etmem,0
kislik urun ozellikleri yok,0
Kraliyet ailesinin bir parcasi gibi hissetmek istiyorsaniz kacirmayin derim. :)),1
Fiyati hic haketmiyor . Kumasi cok basit .urun ilk yikamada soldu sakin almayin,0
Urun hic kaliteli degil kumasi cok sert tavsiye etmiyorum yikandikca soluyor hic begenmedim,0
Asiri kalitesiz kumas,0
Bir yikamada oldu. Kesinlikle tavsiye etmiyorum. rengi igrenc bir hale geldi.  cok kotu soldu. emek cekip dikenlere de yazik.  bu kumasin boyamasinda bu kadar adi boya kullanilmaz. siz sattiginiz urunun adiligini bilmiyor musunuz.,0
Cok kotu sakin almayin ilk yikamada rengi soldu,0
yikayinca rengi hemen soldu tavsiye etmem,0
cok kotu aldigima cok pisman oldum kumasi cok ince ilk yikamada butun renkleri gitti almayin,0
kalite sifr   yazik bu paraya. fiyatinin yarisini etmez . guzel yorum yazanlari anlamiyorum demekki kaliteli nevresim takimi gormemisler. sadece yazik. kumasi sep sert dandik.kandirmayin milleti yorumlarla.,0
Ilk yikamada rengi soldu hic memnun kalmadim,0
urunu hic begenmedim. gorundugu gibi degil hic. rengi ilk yikamada atti. pisman oldum aldigima,0
Parasina gore cok ince ve kalitesiz bir urűn resimde goruldugu gibi canli degil TAVSIYE ETMEM,0
sakin almayin rengi gitti ilk yikamada kumas eridi resmen bu paraya yazik,0
Sakin almayin ilk yikamada rengi soldu,0
kumasi cok ince ama renkleri ve deseni guzel carsafi bayagi kucuk cift kislik deyil,2
urun cok cabuk 1 yikamada renk degistirdi tafsiye etmiyoruz,0
Berbat bir urun ilk yikamada renkler soldu,0
bir iki yikamadi rengi soldu hic begenmedim.tavsiye etmem.,0
1 yikamada renk falan kalmadi. Cope attim,0
kesinlikle almayin paraniza yazik edersiniz gorunuse aldanip aldim bin pismanim oylece dolabimda duruyor birine versem arkamdan kufur ederler resmen paramla rezil oldum anlayacagin.... sakinnnn almaaa,0
"Urunum kusa surede geldi ancak kumasi pamuklu degil, desen fakli ve 4 yastik kifi degil 2 yastik kilifi geldi 🤔",0
urun cok guzel bekledigim gibi geldi...bir tane de kirmizisini siparis ettim onun gelmesini bekliyorum.herkese tavsiye ederim.marketlerle ayni fiyata daha kaliteli ve gosterisli,1
Rengi yikandkca soldu zaten geldigindede canli degildi tavsiye etmem,0
Kesinlikle tavsiye etmiyorum aldik yikadik rengi gitti tamamen kotu. altinimsi parlak bir gorunumu yok .  Kumasida guzel degil,0
kesinlikle tavsiye etmiyorum bayilarak aldim ama 2. yikamada 39 derecede yikanmasina ragmen soldu ve cok ince tulbent kumasi gibi,0
Rengi ilk yikamada soldu asla tavsiye etmiyorum ,0
cok sert kumasa sahip,0
"kesinlikle alakasi yok,berbat ve soluk cansiz bir rengi var.Pazar malindan bile kotu bir kalitesi var iade edicem,kesinlikle tavsiye etmem.",0
ilk yikamada rengi soldu kalitesi cok kotu.  yikadiktan sonra kuculdu. tavsiye etmiyorum,0
